{
  "$schema": "deep-crypto-v1.registry.schema.json",
  "schemaVersion": "3.0.0",
  "registryGeneration": 3,
  "codecFamily": "DEEP-MESSAGING-CODEC-V1",
  "packages": [
    { "id": "E2EE-01", "status": "FROZEN_CLEAN_BREAK", "records": ["DPK2", "DPH2", "DTR2", "DPE2"] },
    { "id": "APPLICATION-CORE-CODEC-01", "status": "FROZEN_CLEAN_BREAK", "records": ["DID1", "DAB1", "DMD1", "DCA1", "DAO1", "DMC2"] },
    { "id": "ATTACHMENT-CODEC-01", "status": "FROZEN_CLEAN_BREAK", "records": ["DAM1"], "dmc2Kinds": [18, 19] },
    { "id": "CONTACT-CODEC-01", "status": "FROZEN_TARGET_NOT_ACTIVE", "records": ["DCB1", "DCR1", "DIA1", "XIR1", "XUR1", "XRA1", "XRC1", "XRR1", "XSS1", "PMA2", "PMT2", "PMS2", "XMG1", "XMC1"], "dmc2Kinds": [2, 3, 4, 14] },
    { "id": "GROUP-CODEC-01", "status": "FROZEN_TARGET_NOT_ACTIVE", "records": ["GIV1", "GIA1", "DGP1", "DGC1", "DGM1", "DGT1", "GCP1", "GCF1", "GSR1", "GSW1", "GSQ1", "GSS1"], "dmc2Kinds": [15, 16, 17, 26, 27, 28, 29, 30] },
    { "id": "CALL-CODEC-01", "status": "TARGET_UNFROZEN", "dmc2Kinds": [20, 21, 22, 23, 24] },
    { "id": "HISTORY-CODEC-01", "status": "TARGET_UNFROZEN", "dmc2Kinds": [25] }
  ],
  "decision": "DR-0003",
  "codecStatus": "PACKAGE_SPLIT",
  "productionActivation": "NOT_ACTIVE",
  "normativeSources": {
    "crypto": "DEEP-CRYPTO-V1-DRAFT.md",
    "applicationBytes": "../../../../architecture/CONTACT-AND-GROUP-PROTOCOL-V1.md",
    "lifecycle": "../../../../architecture/PROTOCOL-REGISTRY-V1.md"
  },
  "contactCodec": {
    "status": "FROZEN_TARGET_NOT_ACTIVE",
    "canonicalGrammarSource": "../../../../architecture/CONTACT-RESOLVER-V1.md#21-contact-codec-canonical-record-rule",
    "vectors": "contact-codec-v1.vectors.json",
    "vectorSchema": "contact-codec-v1.vectors.schema.json",
    "records": ["DCB1", "DCR1", "DIA1", "XIR1", "XUR1", "XRA1", "XRC1", "XRR1", "XSS1", "PMA2", "PMT2", "PMS2", "XMG1", "XMC1"],
    "dmc2Kinds": [2, 3, 4, 14],
    "servicePrivacyRule": "service cannot learn DID1, DeepAccountId32, device ID, DCR1 plaintext, relationship ID, address key or resolver read key",
    "activationRule": "frozen bytes do not authorize runtime/service emission"
  },
  "canonicalGrammar": {
    "byteOrder": "big-endian",
    "recordHeaderBytes": 12,
    "recordHeader": "magic4 || version:u16be || suite:u16be || fieldCount:u16be || reserved:u16be(0)",
    "fieldHeaderBytes": 8,
    "field": "tag:u16be || reserved:u16be(0) || length:u32be || value:length",
    "tagRule": "strictly-increasing-unique-exact-known-set",
    "unknownRule": "reject",
    "trailingRule": "reject",
    "recordMaximumBytes": 65535,
    "projectionRule": "rebuild-record-header-and-field-count-for-the-listed-tags; no placeholder for omitted fields"
  },
  "identityReferences": {
    "accountId": "DeepAccountId32 from the exact current DPA1 account generation",
    "deviceCertificate": "exact 38-byte DPD1 ArtifactRef from dnp1-classical-v1.registry.json",
    "revocation": "exact current DRS1 required by the DPA1/DPD1/DMD1 verification closure",
    "identityArtifactSuite": "0x0001",
    "messagingSuite": "0x0201",
    "permanentDeepIdRule": "DID1 never appears in DPK2, DPH2, DTR2 or DPE2 and is never a session, prekey, mailbox or dedup key"
  },
  "applicationArtifactTypes": {
    "range": "0x1000-0x1fff",
    "DAB1": 4097,
    "rule": "application artifact references use this disjoint u16 namespace; zero, DNP1 codes 1..44 and every unallocated value reject"
  },
  "primitives": {
    "signature": "Ed25519",
    "classicalAgreement": "X25519",
    "pqKem": "ML-KEM-768",
    "aead": "XChaCha20-Poly1305-IETF",
    "transcriptHash": "SHA-512",
    "identifierHash": "SHA-256",
    "braidEncapsulationKeyHash": "SHA3-256",
    "braidAuthenticator": "HMAC-SHA-256",
    "kdf": "HKDF-SHA-512",
    "spqr": "Signal Triple Ratchet with ML-KEM Braid, DeepMlKemBraidFullV1 logical-message profile"
  },
  "sizes": {
    "ed25519PublicKey": 32,
    "ed25519Signature": 64,
    "x25519PublicKey": 32,
    "x25519SharedSecret": 32,
    "mlKem768EncapsulationKey": 1184,
    "mlKem768DecapsulationKey": 2400,
    "mlKem768Ciphertext": 1088,
    "mlKem768SharedSecret": 32,
    "xchacha20Nonce": 24,
    "aeadTag": 16,
    "artifactRef": 38,
    "identifier": 32,
    "braidHeaderPayload": 96,
    "braidEncapsulationKeyVector": 1152,
    "braidCiphertextPart1": 960,
    "braidCiphertextPart2WithHmac": 160
  },
  "suites": [
    {
      "id": 513,
      "hex": "0x0201",
      "name": "DHM2-X25519-MLKEM768-TRIPLE-XCHACHA20",
      "status": "FROZEN_TARGET_NOT_ACTIVE",
      "classicalAndPqRequired": true,
      "runtimeFallback": false
    },
    {
      "id": 514,
      "hex": "0x0202",
      "name": "DHM2-FutureHybridAuthentication",
      "status": "RESERVED_REJECT"
    }
  ],
  "domains": [
    { "label": "Deep/Messaging/V2/exact-dpk2", "construction": "SHA256-D", "purpose": "exact DPK2 hash" },
    { "label": "Deep/Messaging/V2/x25519-signed-prekey", "construction": "SIGINPUT", "purpose": "DPK2 signed-X25519 projection" },
    { "label": "Deep/Messaging/V2/mlkem-prekey", "construction": "SIGINPUT", "purpose": "DPK2 ML-KEM projection" },
    { "label": "Deep/Messaging/V2/prekey-bundle", "construction": "SIGINPUT", "purpose": "complete unsigned DPK2" },
    { "label": "Deep/ContactResolver/V1/sender-ephemeral", "construction": "SHA256-D", "purpose": "XPK1 to DPH2 public-input binding" },
    { "label": "Deep/Messaging/V2/session-id", "construction": "SHA256-D", "purpose": "non-circular DPH2 session identifier" },
    { "label": "Deep/Messaging/V2/handshake-transcript", "construction": "SHA512-D", "purpose": "exact DPK2 plus DPH2 tags 1..19" },
    { "label": "Deep/Messaging/V2/ake-ikm", "construction": "CTX", "purpose": "length-prefixed hybrid AKE components" },
    { "label": "Deep/Messaging/V2/ec-root", "construction": "HKDF-Expand-512-info-CTX", "purpose": "Double-Ratchet initial secret" },
    { "label": "Deep/Messaging/V2/spqr-root", "construction": "HKDF-Expand-512-info-CTX", "purpose": "SPQR initial secret" },
    { "label": "Deep/Messaging/V2/initial-aead", "construction": "HKDF-Expand-512-info-CTX", "purpose": "DPH2 initial payload key" },
    { "label": "Deep/Messaging/V2/dph2-header", "construction": "SHA256-D", "purpose": "DPH2 tags 1..19 hash" },
    { "label": "Deep/Messaging/V2/dph2-initial-aead-ad", "construction": "CTX", "purpose": "DPH2 AEAD associated data" },
    { "label": "Deep/Messaging/V2/exact-dph2-replay", "construction": "SHA256-D", "purpose": "full DPH2 including encrypted tag 20" },
    { "label": "Deep/Messaging/V2/prekey-claim-binding", "construction": "SHA256-D", "purpose": "claim/session/full-DPH2 durable binding" },
    { "label": "Deep/Messaging/V2/braid-auth-update", "construction": "HKDF-Expand-512-info-CTX", "purpose": "ML-KEM-Braid authenticator root and HMAC key" },
    { "label": "Deep/Messaging/V2/braid-output-key", "construction": "HKDF-Expand-512-info-CTX", "purpose": "ML-KEM-Braid SCKA output key" },
    { "label": "Deep/Messaging/V2/braid-header-auth", "construction": "HMAC-SHA-256-over-CTX", "purpose": "ML-KEM-Braid Hdr authentication" },
    { "label": "Deep/Messaging/V2/braid-ciphertext-auth", "construction": "HMAC-SHA-256-over-CTX", "purpose": "ML-KEM-Braid Ct1/Ct2 authentication" },
    { "label": "Deep/Messaging/V2/ratchet-header", "construction": "SHA256-D", "purpose": "exact embedded DTR2 hash" },
    { "label": "Deep/Messaging/V2/hybrid-message-ikm", "construction": "CTX", "purpose": "length-prefixed EC and PQ message keys" },
    { "label": "Deep/Messaging/V2/triple-ratchet-salt", "construction": "SHA512-D", "purpose": "per-session message-key salt" },
    { "label": "Deep/Messaging/V2/message-key", "construction": "HKDF-Expand-512-info-CTX", "purpose": "combined DPE2 message key" },
    { "label": "Deep/Messaging/V2/dpe2-nonce", "construction": "SHA256-D-first24", "purpose": "per-envelope deterministic nonce" },
    { "label": "Deep/Messaging/V2/dpe2-aead-ad", "construction": "CTX", "purpose": "DPE2 AEAD associated data" },
    { "label": "Deep/Messaging/V2/exact-dpe2-replay", "construction": "SHA256-D", "purpose": "full exact DPE2 replay hash" },
    { "label": "Deep/Messaging/V2/state-binding", "construction": "SHA256-D", "purpose": "durable session state binding" },
    { "label": "Deep/Messaging/V2/dedup-mutation", "construction": "SHA256-D", "purpose": "exact durable dedup mutation" },
    { "label": "Deep/Messaging/V2/pq-key-reuse", "construction": "SHA256-D", "purpose": "durable PQ key reuse fence" },
    { "label": "Deep/Messaging/V2/pq-tuple", "construction": "SHA256-D", "purpose": "session/counter/PQ-state tuple commitment" },
    { "label": "Deep/Application/V1/record-hash/<MAGIC>", "construction": "SHA256-D", "purpose": "exact canonical application-record hash; MAGIC is the verified four-byte magic" },
    { "label": "Deep/Application/V1/address-binding-realm", "construction": "SHA256-D", "purpose": "network and deployment scoped DAB1 lineage" },
    { "label": "Deep/Application/V1/address-binding/address", "construction": "SIGINPUT", "purpose": "DAB1 DID1-address signature" },
    { "label": "Deep/Application/V1/address-binding/account", "construction": "SIGINPUT", "purpose": "DAB1 DPA1-account signature" },
    { "label": "Deep/Application/V1/device-directory", "construction": "SIGINPUT", "purpose": "DMD1 tags1..11 projection" },
    { "label": "Deep/Application/V1/contact-publication-authorization", "construction": "SIGINPUT", "purpose": "DCA1 tags1..11,13..14 projection" },
    { "label": "Deep/Application/V1/deposit-salt", "construction": "SHA512-D", "purpose": "DAO1 sealing salt" },
    { "label": "Deep/Application/V1/deposit-key", "construction": "HKDF-Expand-512", "purpose": "DAO1 metadata sealing key" },
    { "label": "Deep/Attachment/V1/manifest", "construction": "SHA256-D", "purpose": "exact DAM1 identity" },